{
  "api_version": "codexploit/v1",
  "findings": [
    {
      "finding_id": "find-0123456789abcdef0123456789abcdef",
      "hypothesis_id": "fp-1-0123456789abcdef0123456789abcdef",
      "path_id": "",
      "audit_id": "task-example",
      "snapshot_id": "snap-example",
      "title": "[CP001] Command execution with a non-literal argument",
      "severity": "high",
      "status": "candidate",
      "confidence": "candidate",
      "supporting_evidence": [
        "artifact-example-native"
      ],
      "contradicting_evidence": [],
      "inconclusive_evidence": [],
      "limitations": [
        "Alert location only"
      ],
      "created_at": "2026-10-18T00:00:00Z",
      "updated_at": "2026-10-18T00:01:00Z",
      "version": 2,
      "fingerprint": "0123456789abcdef0123456789abcdef",
      "fingerprint_version": "1",
      "sources": [
        {
          "observation_id": "obs-0123456789abcdef0123456789abcdef",
          "finding_id": "find-0123456789abcdef0123456789abcdef",
          "scope": {
            "project_id": "proj-example",
            "source_id": "src-example",
            "snapshot_id": "snap-example"
          },
          "task_id": "task-example",
          "producer": {
            "plugin_id": "codexploit.static-patterns",
            "plugin_version": "1.0.0",
            "invocation_id": "inv-example",
            "task_id": "task-example",
            "config_digest": "0000000000000000000000000000000000000000000000000000000000000000"
          },
          "rule_id": "CP001",
          "rule_version": "1",
          "rule_family": "codexploit.command-execution",
          "title": "[CP001] Command execution with a non-literal argument",
          "severity_hint": "high",
          "status": "candidate",
          "file": "cmd/server/main.go",
          "line": 17,
          "end_line": 17,
          "evidence_refs": [
            "artifact-example-native"
          ],
          "limitations": [
            "Alert location only"
          ],
          "created_at": "2026-10-18T00:00:00Z"
        }
      ],
      "severity_audit": [
        {
          "audit_id": "audit-0123456789abcdef0123456789abcdef",
          "finding_id": "find-0123456789abcdef0123456789abcdef",
          "version": 2,
          "previous_severity": "medium",
          "severity": "high",
          "reason": "reachable from the public HTTP handler",
          "actor": "reviewer",
          "created_at": "2026-10-18T00:01:00Z"
        }
      ],
      "reproduce_steps": ""
    }
  ],
  "total": 1,
  "counts": {
    "high": 0,
    "medium": 0,
    "low": 0,
    "ungraded": 0
  },
  "confirmed_counts": {
    "high": 0,
    "medium": 0,
    "low": 0,
    "ungraded": 0
  },
  "candidate_counts": {
    "high": 1,
    "medium": 0,
    "low": 0,
    "ungraded": 0
  },
  "truncated": false
}
